{
  "schemaVersion": 4,
  "accepted": true,
  "conversation": {
    "schemaVersion": 4,
    "conversationId": "00000000-0000-4000-8000-000000000401",
    "title": "Phan tich doanh thu",
    "datasets": [
      {
        "datasetId": "00000000-0000-4000-8000-000000000402",
        "datasetVersionId": "00000000-0000-4000-8000-000000000403"
      }
    ],
    "createdAt": "2026-08-13T01:00:00.000Z",
    "updatedAt": "2026-08-13T02:00:00.000Z"
  },
  "messages": [
    {
      "messageId": "00000000-0000-4000-8000-000000000404",
      "conversationId": "00000000-0000-4000-8000-000000000401",
      "role": "USER",
      "text": "So sanh doanh thu.",
      "sequence": 1,
      "datasetVersionId": "00000000-0000-4000-8000-000000000403",
      "createdAt": "2026-08-13T01:30:00.000Z"
    }
  ],
  "contextEvents": [
    {
      "eventId": "00000000-0000-4000-8000-000000000405",
      "conversationId": "00000000-0000-4000-8000-000000000401",
      "kind": "DATASET_VERSION_ADVANCED",
      "datasetId": "00000000-0000-4000-8000-000000000402",
      "beforeVersionId": "00000000-0000-4000-8000-000000000403",
      "afterVersionId": "00000000-0000-4000-8000-000000000406",
      "sequence": 2,
      "occurredAt": "2026-08-13T01:45:00.000Z"
    }
  ],
  "nextCursor": "cursor-v4-messages-page-2"
}
